{
  "request_id": "req-002",
  "schema_version": "1",
  "incident_id": "inc-20260825-002",
  "tool": "query_media_path",
  "caller": {
    "subject": "dsh-coordinator",
    "tenant_id": "tenant-001",
    "roles": ["incident-reader"],
    "purpose": "diagnose first-frame delay",
    "authorization_ref": "auth://incident/inc-20260825-002"
  },
  "time_window": {
    "start": "2026-08-25T11:00:00Z",
    "end": "2026-08-25T11:10:00Z"
  },
  "parameters": {
    "vehicle_id": "vehicle_hash_001",
    "video_session_id": "video-session-hash-001",
    "stream": {
      "app": "live",
      "name": "cam_f_12"
    }
  },
  "limit": 200
}
