{
  "request_id": "req-001",
  "schema_version": "1",
  "incident_id": "inc-20260825-001",
  "tool": "query_command_path",
  "caller": {
    "subject": "dsh-coordinator",
    "tenant_id": "tenant-001",
    "roles": ["incident-reader"],
    "purpose": "diagnose remote joystick timeout",
    "authorization_ref": "auth://incident/inc-20260825-001"
  },
  "time_window": {
    "start": "2026-08-25T10:00:00Z",
    "end": "2026-08-25T10:10:00Z",
    "clock_domains": ["vehicle_monotonic", "cloud_monotonic", "wall_clock"]
  },
  "parameters": {
    "vehicle_id": "vehicle_hash_001",
    "message_id": "msg_hash_001",
    "include_counter_evidence": true,
    "include_raw_body": false
  },
  "limit": 100,
  "cursor": null
}
